timestamp,speaker,words,tags
,,"So you had that sweet smell of the perc down at the dry cleaners. And yeah, you know, we really weren't looking for chemicals. I think what we were looking for was, there were funny things that over the years had accumulated at that cleaners--things like old costume jewelry that would fall off of people's clothing or out of pockets, and there's no way of figuring out who it belonged to. So there were shoe boxes full of costume jewelry, shoe boxes full of pocket knives, shoe boxes full of cigarette lighters, you know, fraternal pins. So there was lots of stuff to goof around with down there. People would bring in, in later years, bring in their army uniforms or or their service uniforms, and they'd have emblems or patches changed out, and so suddenly there were those laying around also. And so that's ... and then there was a lot of clothing that was just left. People didn't didn't claim them. So it's probably a great collection of vintage clothes down there too. So we used to goof around with that stuff. But chemicals, I don't remember looking for them.",family;postwar
00:39:19,Joan Hua,"She wasn't sure what, she couldn't really describe the story. But I knew I wanted to ask you about the dry cleaner.",family;postwar
00:39:29,Greg Tanbara,"The story that my mother used to tell about the dry cleaners. She said it was very difficult. It was a lot of work. There were a lot of people working there before World War II. And during the internment, they had made an agreement with someone to continue the business on while they were gone, and they came back, and I don't think things were as they had hoped they would be. There was equipment that was gone, and that sort of thing. So they started up again. And it was tough because there were pickets outside of the dry cleaners. Really, telling people they shouldn't go to the dry cleaners. But one story my mother shares is, she says that one day she looked out onto Court C, and there was a fellow in a dress--Navy uniform. And he was just standing out there. And his presence seemed to calm down the people that were protesting the Japanese business. And she said he never came in. But she said that she really appreciated what he did--just stood there in uniform. So that's what, those are some of the memories I remember from the dry cleaners.",family;postwar;internment
00:41:03,Joan Hua,"And then, later, you said you would never let your daughters wander around downtown Tacoma. Was that because Tacoma was different?",
00:41:13,Greg Tanbara,"Yeah, during the '80s and '90s, especially the '90s, it was pretty rough downtown.",
00:41:20,Joan Hua,It wasn't like that before.,
,Greg Tanbara,"No, before, that was the main retail center for the area. I mean, you had department stores like Peoples and Rhodes Brothers department stores. You had the Beaumarchais, was downtown. You had Kress drugstore downtown. You had Market Street, which was not too far from ... my mother's home, was lined with Japanese businesses that were selling produce and meat and that sort of thing. The Italians were selling meat.",downtownTacoma
,Joan Hua,In the '50s and the '60s?,downtownTacoma
00:42:09,Greg Tanbara,"Yeah, yeah. In, well, primarily in the '50s. Started waning in the '60s, and then come 1971, the Tacoma Mall opened. And things really start shifting down there. You also had in the late '60s urban renewal, which took down some of the buildings that were the, you know, the grocery stores ... or the, not grocery stores, but more meat markets, vegetable markets, barber shops--those types of things were along Market Street. The Market Street was named Market Street because there were lots of markets down that way at one time.",downtownTacoma
,,"So, there were a lot of people down there, and I don't know, maybe, I don't know. I think maybe, you know, with the way things change, it may or may not have been more or less safe down there for kids to be running around. But I just can't imagine my daughters at six, seven, eight years of age running around downtown, you know, heading into alleys and looking at what people have dumped and just goofing around down there.",downtownTacoma
00:43:40,Joan Hua,"So, but in the '80s, that was kind of--what I'm hearing--when the conversation about having a university campus, a public university there [started]. Do you remember first hearing about that, and what was your reaction?",uwtCampus
00:43:58,Greg Tanbara,I remember a conversation about two universities looking at downtown Tacoma: University of Washington and WSU. And WSU was pretty aggressive because I think that they had an extension out in Puyallup already. And we're kind of trying to build off of that.,uwtCampus;helicopter
,,"And then something happened. It was a plane, or something about a plane ride. Yeah, that's how the lore goes. And then the University of Washington said, ""Yep, we need to do this."" But, you know, I think the other thing that was happening at that time--that was an important thing, although it wasn't directly related--was, in 1985, I think it was. They were going to take the Union Station down. They were going to take that down. There were going to demolish it, because it, just, something about it being built on, you know, pretty sandy soil or something like that. And that wasn't a big deal, because trains are not that big a deal anymore. And there was a bunch of people that got together and said, ""No, you shouldn't do that. Let's do something different."" And of course, representative Norm Dicks got involved also and had this idea that, you know, maybe, you know, even though it's not a train station, it could be a federal courthouse. ",downtownTacoma;uwtCampus;helicopter
,,"That was a big deal, not just because the project was getting done, but I think this whole thinking about downtown started shifting, because when I was a kid, kind of going back to my memories of downtown, one of the things I used to love doing was coming in, and we used to come in from Seattle or wherever if we're visiting the Seattle Buddhist Temple. Coming in on old 99. And the first thing that you'd see as you're getting ready to go over the Puyallup River is a big neon sign that said, ""Welcome to Tacoma."" And it had, I think, a neon depiction of the mountain or something. So that was like, ""Oh, we're getting near home."" You go across there, you take a right on Pacific Avenue, about 26th or 27th, or whatever it was. And I always thought this is really cool: you go down Pacific Avenue, and there are all these neon lights. And of course, they were all of the adult entertainment facilities. So it was like, I remember, Elmo's Bookstore and, you know, the Fun Circus. And then there was another sign that was so funny. It was--I can't remember which bar it was--but there was a bar that had a big neon sign, and above the neon sign they had this animated neon sign that said, ""With Karen enter a harem."" And they had this depiction of a lady rocking back and forth. And I thought that that, you know, that was very interesting. And, but that was what was there. I mean, it was kind of a seedy part of town. You had the Greyhound bus station that unloaded people. You had the port not too far away. Bremerton's not too far away. And we used to see a lot of probably single guys walking around the street, and that sort of thing. So that's kind of how it was. And then urban renewal knocked down a bunch of a bunch of buildings. And I think people were kind of wondering, you know, ""Is it going to always be that way?"" And it was about '85. Also that the EPA declared Commencement Bay a Superfund site. So it's like, uh-oh, got to figure out something. So there were a bunch of things that came together at that time. ",downtownTacoma
,,"And I think the decision by the university to come here was ... initially people were going, ""Oh, what's that mean?"" I mean, is it going to be like a UW campus, you know, brick and Ivy, down here? Or maybe they should move into some vacant land up by Tacoma Community College or, you know, maybe it's over ... it ought to be someplace else. And I think about that time--also the Tacoma Dome comes up and is built.",downtownTacoma;uwtCampus
,,"So I think, you know, a lot of people--and I agree with them--the university deciding to come here was a very pivotal point in the city's downtown development. I mean, it is like, I don't know if the direction was headed in that way, but it gave it the kind of nudge that got people thinking about things like, ""Oh, well, what about museums? Or what about, maybe, you know, we figure out how to purchase all that property around a Foss waterway and turn it into something else. And I think to a certain extent, places like Point Ruston, and all those other things leverage off of some of that change in perception in the downtown area. And, you know, we had other things that were real assets that maybe were underutilized, like Point Defiance and that sort of thing, too.",downtownTacoma;uwtCampus
00:49:52,Joan Hua,You knew more about the decision like UW vs. WSU than I would have guessed. So did you know about that through like news articles or from your work or something else?,
00:50:10,Greg Tanbara,"Just people I ran into. They say, ""Oh, you know what? This is what Ryan Petty did. Isn't that pretty cool?"" It's like, ""Oh, yeah. Okay."" So, you know, that's probably where I heard about it first, and then there probably were other articles that kind of filled in the blanks a little bit. But there are other folks like the Executive Council is getting up to speed. And so people like Ray Corpuz and Bill Philip and those folks were thinking about, How do we move things? You know. How can we push some things forward here? And so that's happening about the same time also.",uwtCampus
00:50:55,Joan Hua,"Was that that Puget Sound, South Puget Sound Executive [Higher Education] Council?",
00:51:00,Greg Tanbara,"No, it's the Executive Council [for A Greater Tacoma]. Early days, not very many people knew about it, but they would get together every once in a while, and they'd say ... It was business and power brokers in the community.",communityAdvocates
00:51:18,Joan Hua,And they were just called the Executive Council?,
00:51:20,Greg Tanbara,"Executive Council. Yeah. So they're kind of, you know, not that many people--I think it was when the museums came up. And Bill Philip says, ""We're we've got to do this. Let's just do it."" And they did it.",communityAdvocates
,,"So I don't know whether they get a lot of public input. I don't think there was a lot of public input. It was just, ""We're gonna do this."" And so they coordinated some--I think that the museums, especially the ... well, art museum was already pretty much established, but like the glass museum. There was no glass museum. Yeah, there was no Chihuly Bridge. There was none of that stuff. And I think it was foresight and tenaciousness of some of those people to get something going. They were also very much involved in the Theater District. I mean, the Theater District was there; the bones were there. But it's like, you know, when I was growing up, I had no idea that the Pantages was a vaudeville. I just figured that it was someplace you went to go see movies on Saturday--cartoons and a double feature, and eat as much popcorn as you could. I mean, you know. I had no idea. I had no idea.",downtownTacoma;historicPreservation;communityAdvocates
,,"Were you involved in any of that? I know there was, like, Union Station, there was the Save Our Station group. Were you involved in that?",
00:52:58,Greg Tanbara,"I knew the people. I just was not ... I, you know, at that time I was working for the state and just real busy, just doing stuff, but I was working downtown. And through a series of circumstances, I ended up being part of the Rotary Club and some other place. So I ended up coming in touch with people that were working on these sorts of things. And so I feel really fortunate that way. And it was like an accident that I ended up in that Rotary Club through a series of circumstances.",communityAdvocates
00:53:02,Joan Hua,What were you doing for the state?,
00:53:42,Greg Tanbara,"I was working for the Employment Security Department when so much of this was going on. Let's see ... between 1978 and about 1985 I worked on a youth employment program. And it was a program that was being funded with federal funds, Department of Labor Funds, but they decided that they wanted to bring the employment service in. And they wanted to find a really cheap place to put us to help kids find jobs. And so they stuck us in the, at that time it was called the Medical Arts Building; it became the municipal building. So we were in kind of a bombed-out section that they hadn't rehabilitated yet. And so I was downtown.",workforce
00:54:49,Joan Hua,So does that crossover with any conversations about ... because the idea of having a public higher education institutions in Tacoma had something to do with building a workforce and--,workforce
00:55:04,Greg Tanbara,"That's right. So the employment service was very interested in this also. I mean, you know, Booth Gardner, was he governor at that time? Yeah, about that time. He was coming up. He was county, I think, at least county exec at that time. You know, he's a Tacoma person and is connected I think through his family to Weyerhaeuser family and that sort of thing. And so those things are ... so, people say this is a small town. This is a teeny town in some ways. And so, you know, I'm working downtown, and one of the parts of that youth employment program had to do with the Rotary Club. Rotary Club was looking for a big project and we pitched them on, ""Why don't you invest in this combined effort of helping young people find work?"" And they said okay. And that's how I ended up joining the Rotary Club. And so it was just, it was, I mean, I was not my idea. The president of the Rotary ended up talking to somebody in the governor's office, and they connected them to the employment service. At that time, Dr. Eugene Wiegman, who was the past president at PLU, at the time was Commissioner of Employment Security Department. He's a Tacoma person also. And he said, ""Yeah, that's a great idea."" So they pitch their membership to contribute a certain amount of money and hire a staff person that would link young people looking for work with Rotarians. And Dr. Wiegman said, ""Maybe we ought to put Greg in that Rotary Club."" So they paid my dues for a little while. And yeah, so I was the first person from the employment service to be in that Rotary Club. And so they made up a designation for me and stuck me in there.",workforce
00:57:16,Joan Hua,"I've also heard that maybe the Executive Council or some of those people, they were trying to bring businesses to Tacoma, and when they decided to go elsewhere to a similar sized city, they kind of would ask them, ""How come?"" And one answer they got was that they chose cities that had a university so that they could hire locally.",workforce
00:57:42,Greg Tanbara,"Yeah. So you know, you have people sitting on the Executive Council. Ryan Petty, who is director of Economic Development [Board] for City of Tacoma, later on for for Pierce County. You have Ray Corpuz, who was the city manager. You have people like George Russell, who evaluates, you know, investment programs worldwide. You have Weyerhaeuser, who was involved in many, many things on an international basis. So you had people with very wide perspectives on community economics. And then they're all Tacoma people. So they are, have a good sense of what they hope would happen and at a community level also.",workforce;communityAdvocates
00:58:38,Joan Hua,You've mentioned some of them already. But what are some other key events in the Tacoma community that you think influenced that founding and development of the UW campus in downtown Tacoma?,
00:58:52,Greg Tanbara,"I think getting started in the Perkins Building was interesting. That's right downtown, not too far from from where we're at right now. I think those first ... what was it? Either eight or 15 people that graduated? I mean, that was a big deal.",
00:59:12,Joan Hua,"The first graduation had five people, but they attended for a year. And then--",
00:59:18,Greg Tanbara,But that was a big deal. That was a really big deal.,
00:59:24,Joan Hua,Were you there?,
00:59:25,Greg Tanbara,"No, I didn't make it there, but I read about that. And I was, you know, I did ... I went to the Perkins Building. What did I do at the Perkins Building? I was there a couple times to do something with the university. I can't remember what it was. It might have been just trying to figure out how I could get some of the young people I was working with into the university. That sort of thing.",
,,"But I do remember that first graduating group, and that was a big deal. That was a big deal downtown. I think that the interest from the university to reuse some of those buildings on Pacific Avenue was a big deal. I think some people were going, ""What's the big deal about that?"" But I think that's become a big deal because it, at least for me, from a personal standpoint, it helps me connect, like the before and after, and what's coming next. That was a big deal.",uwtCampus
,,"Another big deal for me personally was the university's interest and commitment to getting Maru installed. And that's another one of those--we lucked out. You know, there was a initial gift that got the thing rolling after kind of sitting there for 10 years. And that was through the creativity of, or receptiveness, on the part of the university and their patience, as well as their relationship with the Greater Tacoma Community Foundation. So those are big deals.",uwtCampus;memorial
01:01:22,Joan Hua,"How do you think--you said, it redeveloping, like the warehouses, helped you connect the location with the past. How do you think it does that?",
01:01:36,Greg Tanbara,"It reminds me that things change and that there is this creative tension between preserving the past and looking to the future. It's not a thin line. It's a very gray area that I think  gives people an appreciation for what's going to come by knowing something about what has happened in the past. So, example is, in fact, I was just describing this to somebody the other day: If you take a look at Maru, you get this big, round void in the middle. And the way I think about that is, I look through one way, and I see the Prairie Line Trail going up and kind of off into the distance, and I'm reminded that the Northern Pacific Railroad--that was one of the first lines into the city here. And one of the significant things is, it has, what is that, two-percent grade someplace, which was the steepest grade I guess as they came across the continent. So it's big deal there, and it's the terminus. ",uwtCampus;memorial
,,"And you look through the other way, and you see the art museum and the Foss Waterway. So there's this thing about looking one way and then looking the other, maybe looking at the past and getting a glimpse of the future, that the university really represents to me. I mean it, you know, you get the old buildings, but they're repurposed, but they're not going to be the same thing that they are today forever, just like they aren't the same thing that they were yesterday today. That's I think an interesting thing. And an important thing for people here in Tacoma because ... I thought, you know, the other--you were asking about significant things--when the university came, it was about, you know, that the SOTA school opened about, you know, in that same kind of rough timeframe. And I think the combination of UW students and the SOTA students downtown, it made all the rest of us look forward and behave a little bit better than we were in the past. You know, we kind of say, ""Oh, you know, Pacific Avenue is a bunch of strip clubs. It's always going to be a bunch of strip clubs."" It didn't have to be that way. I think things evolve and change out of what was before. And then we also need to know that maybe what we think is good today is not going to be so good tomorrow. And that's what the university reminds me of.",uwtCampus;memorial
01:05:02,Joan Hua,"So you mentioned how the university's preserving the warehouses. And some would point out the contradiction when you have a few buildings remaining from the old Japantown--including the Japanese Language School building that you were describing. And after the university purchased it, eventually it was demolished, and some would point out the contradiction. Can you describe some of those events and what your attitude towards that was?",uwtCampus;jls
01:05:40,Greg Tanbara,"You know, the Japanese Language School--I know it was on the Historic Register, and I have many fond memories of growing up, you know, in that building, you know, horsing around with my sisters and my cousins and in that place, but also know things change. Nothing's permanent. I think that the, I would hope, that the lessons learned and some of the perspective drawn from, you know, the comings and goings of Japanese Language Schools could be preserved somehow. But I know that, you know, as I'm talking to you today, I have an interpretation of what the meaning was of that Japanese Language School. But it'll change over time. It'll change over time. I think the main thing is, for us, is to not maybe remember exactly how it was, but how things have changed. And looking forward that way. And maybe remembering that there are some things that ended up being more significant in different ways than what we realized at the time. If you take a look at that school song that they had in the Japanese language, you know, it's pretty amazing. That's a very forward thinking, you know, ""I'm in this new land. I, you know, I need to make sure that I'm honoring my community and my family by being the best I can, but this is a new adventure."" I mean, that's ... I was blown away after I saw the translation of that. So there's stuff like that that is there. You know, there might have been some neat things that would have happened if that building was still around. I don't know. I mean, that, you know, who knows what's gonna happen there. I think that the next opportunity will be the Tacoma Buddhist temple that's been there. And unlike the Japanese Language School, that's still alive. It's still being used. So I think that that provides another opportunity for all of the stakeholders, including the university and maybe the congregation there. What are we going to do with that? You know. How does--you have the building, you know--how does building, you know, provide us some way of thinking about the past and looking at the future? What about our relationships? I remember speaking to somebody at one point, and they said, ""Well, you know, universities are prohibited from non-secular, supporting non-secular thing."" What is that? I don't know. I don't know what that means. Maybe that's a question. What can be the role? And do things always have to be the same? Or do they change?",uwtCampus;jls;historicPreservation
01:09:15,Joan Hua,The song you mentioned is--,
01:09:18,Greg Tanbara,"I don't remember the name of the song, but it is on a website that, it was a school song that was adapted. It's a song that is sung, I think in Japan also, but it was adapted for the Japanese Language School by Yamasaki Sensei. I look at the lyrics as they're translated, and it just blows me away that that was done in the 1920s, and It's like, oh, that's--",jls;memorial
01:10:02,Joan Hua,But you weren't taught the song?,
,Greg Tanbara,"No, because I, you know, I went to Japanese Language School for many years on Saturday. I was the worst student. I think you gotta be smarter than I am to understand and be able to speak Japanese. I think, you know, that's kind of how I see it. My sisters and my cousins were much better at it.",family;jls
,Joan Hua,"And I did want to ask you about your aunt and uncle. They own, they were taking care of the building after your grandmother. And can you talk a bit about what they were like?",family;jls
,Greg Tanbara,"My uncle Leo Kawasaki. He's from Fife, grew up there. Kawasaki family had a farm there. They knew my my grandmother, Mitsu Fujimoto, many years. And my uncle Leo and my aunt Tadaye were married shortly before my parents were married. And my uncle Leo is--there were eight in his family. His eldest brother ended up taking him with a farm in Fife. And so my uncle Leo ended up coming in and operating the dry cleaners here in Tacoma.",family;jls
