timestamp,speaker,words,tags
,,"I give those two folks a lot of credit. They had four children--Gary, Mark, Ann, and Joy. And as it turns out, their ages just dovetail pretty much with myself and my siblings. Gary is a year older than I am. Mark is a year younger. Mark is a year older than Diane, my sister. Diane is a year older than my cousin Ann, and then Joy is a little bit younger, and then my youngest sister, Merilee, is a year, though you haven't met. So our families were, I mean, age span. There were people right with us all along the way. But I give them a lot of credit because my grandmother stayed with them throughout the time that I knew her from 1953. When I was born, she was there in the house with my aunt and uncle, and throughout the time that they were raising their kids. So my cousins had their grandmother living in the same home with them. And we would see them every Friday also. My aunt and uncle were both very active in the Tacoma Buddhist Temple. And taking care of the Japanese Language School was a tough thing for them because it's a big building. They didn't have a lot of people using it hardly at all. So you have to, you know, take care of a building when people are trying to break in and take stuff out of it. That was tough. And then at the same time, you know, there were people across the country who had gone to the Japanese Language School. So there was that kind of pressure of obligation. If people came back to town, boy, they always wanted to go to Nihon Gakko and take a look at it. They would hope that it would be a look as they remembered it, but the building's getting older, and tons of deferred maintenance on it, and people trying to bust into it. It's ... that's a hard thing to do. So I think that ... and they're business owners, so they're busy doing that. And that building, you could see that building all the time, from my grandmother's house. I mean, it was just up the hill across the alley. So there were, I mean, the presence was always there, always there. When we were going over to my grandmother's place on Sundays or Saturdays, you just always knew that building was there. So that was ... I think that weighed pretty heavy on them in terms of an obligation.",family;jls
,,"So I think they were very, very glad that the university eventually purchased that property. Because it just seemed like the right thing. You know, the educational institution. I don't know how they felt about the building coming down. You know, I think my my uncle probably had had enough of the building by the time the university had made this decision. I know that there were some people that were saying, ""Oh, but it's on the Historic Register."" But I think about a comment I remember Mike, and you know Mike Wark? You remember Mike?",family;jls
01:15:56,Joan Hua,"I didn't meet him, but I know who you're talking about.",
01:15:58,Greg Tanbara,"One of the first times I met Mike was ... when was this? I bet it was early 2000s. So, I'm working for the City of Tacoma, and they said, ""You know, Greg, they're a bunch of, there's contingency from Korea coming to visit the City of Tacoma. They want to take a look at this notion of restoration here. So why don't you show them around? Figure this out. Figure out what people ought to see."" So I thought, ""Okay, well, I better get a hold of the universities because they've been doing all this work downtown."" So that's how I meet Mike Wark. And so he takes us on a wonderful tour through the building, the warehouse buildings, and talks about the reuse of lumber and how, you know, we've done this and that and so on and so forth. And we're working through a translator, and the folks from Korea, there's some developers, some construction people, and I think some real estate people. And we get down to the end of the tour. We're standing not too far from where Maru is now, getting ready to cross Pacific Avenue to get over to the Art Museum. And Mike stops, and he says, ""Oh, thank you very much for coming. And does anybody have any questions?"" And a hand goes up in the back. The first question were asked on the whole tour, because nobody has any questions until then. And I'm a little bit surprised because the person in the back speaks English very well. I just figured that everything was going through this interpreter, translator. And he says, ""Why are you saving all of these old buildings? They're from the early 1900s. Why don't you just knock them all down? It'd be a lot more efficient to replace them with modern buildings."" And Mike says, ""Well, you know, because they're historic."" They said, ""Well, when were they built?"" ""Oh, 1900."" ""That's not that old."" So, I said, ""Thanks a lot, Mike. We'll see you later."" So my point is this. Old's relative, okay. And 1929, or 1922, when that building was originally built, and then I think there was an addition a couple years later--that seems pretty old. I mean, it's older than I am. So it's old. But things change, you know, and that's kind of how I see it. I have fond memories of that building. But even if the building was restored, and I'd go in there, it'd be different. Because it's a different time. You know what I mean? So that's kind of how I see it. Buddhist Temple's different because I still go in there. And so I have this continuum thing. And I can imagine that being something else and, you know, maybe the university and the temple get together on something.",uwtCampus;buddhistTemple;historicPreservation
01:18:20,Joan Hua,"And so you said you still go to the Buddhist Temple. And you helped to organize the Bon Odori, too, or were you involved in other projects?",uwtCampus;buddhistTemple
,Greg Tanbara,"They oftentimes have a job for me. And it has something to do with serving food or something. So I have almost 50 years of food service experience I can put on my resume. One or two times a year I'm working at the bazaar at the sukiyaki there. So, no, I'm not--I was on the board at one time. I remember at that time, that was early on when I think the footprint had been just established. And so there were conversations about what's going to happen to the church. When eminent domain occurs and the university takes property.",uwtCampus;buddhistTemple
,Joan Hua,And are you involved in any like Asian Pacific Islander communities or Japanese American communities in the Tacoma area?,
01:20:48,Greg Tanbara,"Not so much right now. I served on the board of the Tacoma Community House, couple terms ... can't even remember when that was. I think it was a long time ago. I have been a couple terms on the board of directors for a groups--they're gone now--a long time ago. Right now. There's kind of an informal network of Asia-Pacific Island folks--we will get together for lunch after this. Yeah, so, not so much. Not so much right now. But like I said, I've got 50 plus years of food service experience through my affiliation with the Buddhist Temple.",
01:21:43,Joan Hua,Should come in handy someday.,
,Greg Tanbara,"Yes, someday it'll come in handy, right?",
,Joan Hua,"From your point of view, what role does the institution of UW Tacoma have to play--in terms of maybe preservation, education, or social responsibility--in its relationship with the neighborhood?",
01:22:20,Greg Tanbara,"I think the university can play a very important role, because you have business perspectives, you've got community perspectives, you've got special interest group perspectives that always come together on whether it's liquefied natural gas plants, whether it's Tacoma Creates, you know, sales tax increase, transportation, you know, public transportation issues like Link connections. All of those perspectives are, you know, some of them are more established than others, but I think the university brings a little bit of a different perspective. Of course, you know, there are always going to be folks who say, ""Well, the university's interested in that because the live Link runs through the university. They've got a stake in this thing."" But I think that the university has a role to ask sometimes those questions that nobody wants to ask because you're a different, different outfit that way.",uwtCampus
01:23:45,Joan Hua,What are those questions?,
01:23:46,Greg Tanbara,"Will those questions might be, I mean, like one is, ""Well, why the heck did you work on this Maru thing? Why is that? The building's gone; the Japanese community, they've dispersed all over the United States."" A lot of the kids that grew up, you know, sanseis, we came up during the '70s. And unemployment was really high in Tacoma, and there were no jobs here. So that's when we made a home someplace else. And why don't they come back? Because, you know, you got to come all the way from Seattle or wherever to come to church every week. That doesn't make any sense. We've got other institutions we can get together with up there. So what's the deal? And nobody took, you know, the number of people ... Greg's like one of the last ones that sat in that Japanese Language School, so what's the big deal? I think the university did a great job. And to turn into, ""Why is it a big deal?"" You know, this is, this is, I mean--the big deal is not Greg or not the Japanese Language School, but it's this idea that things change and that we can learn from the past and looking toward the future. The future is not going to be the same as the past. I mean, that's really good stuff.",uwtCampus;memorial
01:25:08,Joan Hua,"And you said you worked with the advancement office or the development office on the memorial or the Maru, right? What did you do?",uwtCampus;memorial
01:25:20,Greg Tanbara,I just gave them some input. I made sure my mom and dad got to the meetings. And then I just spoke to a bunch of people about making a contribution and gave the university ideas on maybe how they might approach some folks.,uwtCampus;memorial
,,"That was a neat project because I think a lot of people that contribute to that, especially from the Japanese community, had not done something like that before. They've made their contributions to like the church or the bazaar or, you know, those organizations that might be working to make sure that the reparations to Japanese internees was made. I mean, they make contributions that way--to Japanese American Citizens League, that sort of thing. But I think Maru was interesting, at least to me, from a local standpoint because it brought people like the Williams, who provided that first contribution. It put them together in a project with people that, you know, wouldn't have thought about maybe making a art contribution, or contribution for a piece of art. So that's what the language, I mean, there were students, you know, ex-students, people making contributions in memory of students. And so it was a different mixed bag of people. It wasn't the usual gang that makes contributions. I think it pulled in a bunch of other people. So that was a neat thing.",uwtCampus;memorial
01:27:28,Joan Hua,"Through that project, was there something that you learned about UW Tacoma that you didn't know before? Either about the students--",
01:27:37,Greg Tanbara,"I learned that if you work on a project like that, you're going to end up getting a chance to meet Ali Modarres and end up on his advisory board. The other thing I learned about the university is that there are people here, like Lisa Hoffman, okay. I didn't know Lisa that well before. She ends up being a neighbor of mine now. So it reminds me that even though sometimes you think, ""Okay, University of Washington--that's Seattle, Huskies, you know, Apple Cup, all that kind of stuff is kind of way off someplace else. It's not so way off someplace else. It's like right here. And so that's been a neat thing for me. I feel much closer to the university than I did before, because, for me, it used to be just up in Seattle. And yeah, that's how it was.",
01:28:41,Joan Hua,And do you have interactions with students at UW Tacoma?,
01:28:50,Greg Tanbara,"Only through all these projects. Matt Kelley has sent some people toward me. You know, with regard to my work at the Health Department, and mapping, that sort of thing. What else have I done?",
01:29:12,Joan Hua,Are you also on the board for Milgard's Center for Businesses [Leadership] and Social Responsibility?,
01:29:19,Greg Tanbara,"I think I was doing some advising on projects. Yeah, that was Joel Lawless's group. Okay. And then, so they would have students do kind of internships at different places. So I was helping them just think about what places students might, what nonprofit places students might hit into. So I was more involved when Joe was involved in that project. Not as much now.",
01:29:52,Joan Hua,"Okay, and we're getting to the end of the interview. I want to ask--so as UW Tacoma is moving toward developing its campus on land up the hill, how do you see it honoring the past and current identities and communities of the location?",
01:30:15,Greg Tanbara,"Well, my perspective centers around, my stake is that Tacoma Buddhist Temple. I think that that, you know, with the university's help, can evolve into something that is more than we can even imagine right now. I think Jodo Shinshu Buddhism has a lot to offer folks. You don't have to become a member. I think it's more wide ranging than that.",uwtCampus;buddhistTemple
,,"The challenge for the temple of course is that much of what is there is from a Japanese and Japanese American perspective, so that needs to be tweaked somehow to find the sweet spot for the university and the congregation. But I think both are well positioned, because I would imagine at some point, just like me back in the late '70s, early '80s, I was thinking, ""Okay, university comes here. You're going to have the usual brick and ivy-covered walls. And, you know, that kind of the usual thing. Well, we don't have the usual thing. I mean, it didn't end up being the usual thing. And I think that from the temple's standpoint--and I didn't learn this until later on--but Jodo Shinshu in Japan is very different than Jodo Shinshu here. They both are part of the same Buddhist tradition. But Buddhism has changed a lot and gone a lot of different ways since it was in India. I mean, you take a look at Thailand; Buddhism is different than it is in Cambodia, or in Korea, or in Japan. And then as you come over here to the United States, it's very different from Jodo Shinshu in Japan. And so kind of going back to that Japanese Language School. You're not maybe doing what has been the natural thing to do by trying to hang on to something forever. It evolves. And so, as the university grows, I would hope that it can find a way of blending, you know, that temple into who it is.",uwtCampus;buddhistTemple
01:33:26,Joan Hua,"Great. So before I end the recording, is there something like a story or something else that came to mind that you still wanted to include?",
01:33:35,Greg Tanbara,"Oh, there are a ton of stories. I'll close by just saying that, you know, I mentioned the one time that the university has made a huge difference to the downtown. And yeah, from an employment standpoint and from job training standpoint, obviously very, very important. I think that the university is also--",
01:34:05,Joan Hua,And I'll remind you that your hand is kind of touching the mic.,
01:34:08,Greg Tanbara,"I think that the other thing that the university is trying to do consciously and is becoming better and better at it--and I think the community has to get better and better at it, too--is thinking outside the box. I think the university's got a tradition of doing that--kind of a newer thing for them to do as a urban-serving institution. And then, Tacoma as a community has to maybe adjust how it perceives the university also. They're going to be parts of the city--and those of us that have spent a lot of time downtown like me; you know, I'm fortunate because I've had a chance to go to higher ed and that sort of thing; I'm very comfortable here. But I know there are parts of the city and the county where people have just never been here, even though this is the, you know, UW Tacoma. It's a strange place for them. So I think that's a challenge. That's a challenge for the university. We'll get there.",
01:35:23,Joan Hua,Okay.,
01:35:24,Greg Tanbara,Good? That's it.,